commit	val_mse	memory_gb	status	description
541306c	9.520277e-01	3.65	DISCARD	HYP-6.1 pseudo collocation resampling every 500 Adam steps
d4d8f96	6.858262e-01	1.44	KEEP	HYP-4.1 hard periodic feature transform with sin/cos theta inputs
7dcb213	9.290239e-01	1.35	DISCARD	HYP-4.2 hard initial-condition output ansatz with periodic interpolation
a883cfd	6.862256e-01	4.84	DISCARD	HYP-7.1 NNCG refinement after L-BFGS on the hard-periodic baseline
52cd290	6.940603e-01	1.41	DISCARD	HYP-4.3 harmonic search with time=1 theta=2
c268446	6.908429e-01	1.44	DISCARD	HYP-4.3 harmonic search with time=0 theta=2
11221c8	6.940841e-01	1.40	DISCARD	HYP-4.3 harmonic search with time=1 theta=1
2841bb2	6.951220e-01	1.49	DISCARD	HYP-4.3 harmonic search with time=25 theta=5
96c3f8f	6.840374e-01	1.44	KEEP	HYP-7.4 causal PDE weighting on the hard-periodic baseline
6edc9b9	6.865027e-01	1.44	DISCARD	HYP-6.4 Sobol collocation sampling on the causal-weighted model
048e481	6.833956e-01	1.44	KEEP	HYP-7.7 callback-safe LBFGS and lean IC bookkeeping
3723d3f	6.828914e-01	1.44	KEEP	HYP-7.2 Adam and L-BFGS ratio tuning
9425a51	6.841658e-01	0.89	DISCARD	HYP-8.1 mixed precision training
f8e13a7	6.856742e-01	1.44	DISCARD	HYP-6.2 residual-based adaptive refinement
343f45f	1.170289e+00	1.75	DISCARD	HYP-1.1 sine activations
0da4dc5	6.949009e-01	2.53	DISCARD	HYP-6.3 R3 adaptive resampling
7ab8c13	6.864758e-01	3.72	DISCARD	HYP-6.5 residual-based adaptive distribution
88e3de8	6.941374e-01	2.14	DISCARD	HYP-6.6 RAR-D adaptive refinement
d97a2e7	7.575254e-02	1.95	KEEP	HYP-4.4 exact Fourier hard initial-condition ansatz
1b82e3f	8.380339e-02	2.06	DISCARD	HYP-4.5 hard-IC harmonic bank time=25 theta=5
0cd5663	8.986620e-02	1.95	DISCARD	HYP-7.8 NAdam warmup with gradient clipping
403b218	8.628124e-02	1.95	DISCARD	HYP-6.7 hybrid residual-based adaptive refinement
68ce0b5	5.809172e-02	1.93	KEEP	HYP-4.6 domain normalization with exact chain-rule scaling
ae19573	5.940263e-02	4.23	DISCARD	HYP-4.7 explicit periodic boundary losses
b3059f3	6.150582e-02	3.25	DISCARD	HYP-1.6 SiLU activation on normalized hard-IC model
5eff0f0	5.967371e-02	2.44	DISCARD	HYP-1.7 GELU activation on normalized hard-IC model
361b289	1.759055e-01	1.94	DISCARD	HYP-1.5 polar residual formulation
402da5a	5.837114e-02	1.93	DISCARD	HYP-7.9 Adam cosine LR schedule
ee447a5	6.023192e-02	5.49	DISCARD	HYP-7.6 gradient-enhanced PINN loss
0f429b4	5.800351e-02	1.93	KEEP	HYP-6.8 Gaussian-biased static collocation
48e221c	6.021131e-02	3.03	DISCARD	HYP-1.4 modified gated MLP
1112dce	5.666258e-02	1.93	KEEP	HYP-6.9 beta-biased time sampling
3b30526	5.746475e-02	2.04	DISCARD	HYP-1.8 random Fourier features
3e78a50	6.338103e-02	1.94	DISCARD	HYP-7.3 self-adaptive PDE weights
4480370	5.928781e-02	2.26	DISCARD	HYP-1.9 wider shallower MLP
feca3a6	5.719010e-02	1.93	DISCARD	HYP-6.10 mixed beta and uniform time sampling
2eebf1c	5.726087e-02	1.93	DISCARD	HYP-7.10 phase-wise causal annealing
4ae3207	5.722090e-02	2.27	DISCARD	HYP-5.4 asymptotic breather stabilization loss
818fd37	5.700551e-02	2.11	DISCARD	HYP-5.5 spatial parity prior
65b4fba	5.718708e-02	1.93	DISCARD	HYP-5.6 CW edge-derivative damping
4dbee50	5.711783e-02	1.93	DISCARD	HYP-6.11 stronger beta time bias
32eb740	5.776918e-02	1.93	DISCARD	HYP-6.12 narrower Gaussian spatial bias
83cc6f8	6.614328e-01	1.93	DISCARD	HYP-7.5 PDE residual splitting
74ed4a0	6.123170e-02	1.94	DISCARD	HYP-7.11 intensity-scaled residuals
5be4628	6.191092e-02	1.93	DISCARD	HYP-7.12 MAE loss
e70fdca	5.797618e-02	1.94	DISCARD	HYP-5.2 CW background matching penalty
d3ff945	5.701195e-02	2.11	DISCARD	HYP-4.8 periodic loss only in LBFGS
27ad652	5.689638e-02	1.93	DISCARD	HYP-6.13 ten-batch RAR pool
49778d3	6.055001e-02	3.83	DISCARD	HYP-8.2 float64 precision
9e96a2c	6.066724e-02	2.42	DISCARD	HYP-2.2 separable PINN core
8601a7f	5.668185e-02	1.94	DISCARD	HYP-5.1 late-time periodicity prior
ca83de2	5.661969e-02	1.94	KEEP	HYP-5.3 global power stabilization
22090d8	5.945323e-02	0.90	DISCARD	HYP-3.1 FFT spatial derivatives
dea32d7	4.465095e-02	2.05	KEEP	HYP-1.2 MsFFN-style core
c5ec18c	5.256128e-02	3.60	DISCARD	HYP-1.3 MsFFN-ResNet core
7115db1	1.434264e+00	1.55	DISCARD	HYP-3.2 neural spectral coefficients
e233409	6.707246e-02	2.33	DISCARD	HYP-2.3 complex-valued PINN core
df71011	7.651660e-02	9.48	DISCARD	HYP-2.1 spline PIKAN core
57c9d82	4.500937e-02	2.06	DISCARD	HYP-5.7 late-time cycle consistency on MsFFN
ee5118d	4.889051e-02	2.07	DISCARD	HYP-1.10 three-scale MsFFN feature bank
39fb553	4.499337e-02	2.05	DISCARD	HYP-5.8 global power curvature penalty
9553a48	9.610675e-02	2.05	DISCARD	HYP-7.13 stronger physical-time causal weighting
28c43f1	2.210094e+00	3.12	DISCARD	HYP-5.9 hard CW-background subtraction
1ffd5c7	4.511156e-02	2.05	DISCARD	HYP-11.1 targeted breather-peak sampling
e78b320	3.716117e-02	2.08	KEEP	HYP-11.3 breather-tuned Fourier features
4a8a5ca	3.735390e-02	2.08	DISCARD	HYP-9.1 ReLoBRaLo callback
498c02e	3.484739e-02	2.08	KEEP	HYP-9.2 time-marching curriculum
9a5b502	3.376563e-02	2.08	KEEP	HYP-11.2 R3 sampling callback
563eb47	3.798376e-02	2.08	DISCARD	HYP-11.4 earlier full-domain R3 refresh
a3850c2	3.460632e-02	2.08	DISCARD	HYP-11.5 gentler R3 refresh
d9cba79	3.621968e-02	2.08	DISCARD	HYP-11.6 raw-residual R3 scoring
6b87ba2	5.771856e-02	2.08	DISCARD	HYP-11.7 complementary late-time R3 resampling
b13a79f	3.735495e-02	2.09	DISCARD	HYP-11.8 richer breather time harmonics
285c01b	nan	nan	CRASH	HYP-10.1 temporal attention core
941234a	4.160770e-02	2.26	DISCARD	HYP-10.1 manual temporal attention core
cce3449	3.760736e-02	2.08	DISCARD	HYP-11.9 more frequent R3 refresh
bf2a943	3.635723e-02	2.37	DISCARD	HYP-10.5 spectral attention gate
6e0d913	6.153584e-02	2.59	DISCARD	HYP-12.2 L-LAAF core
364dd55	4.137271e-02	2.08	DISCARD	HYP-12.3 learnable causal annealing
e9a45ff	3.408787e-02	2.60	DISCARD	HYP-10.7 factorized space-time gating
df2dd1e	6.130872e-02	2.08	DISCARD	HYP-12.5 EMA PDE balancing
b0639d4	4.296569e-02	2.64	DISCARD	HYP-10.6 exact-IC cross-attention
161e4e6	3.323696e-02	2.08	KEEP	HYP-12.4 progressive R3 retention
74abbe4	3.412243e-02	2.08	DISCARD	HYP-12.7 ultra-exploratory R3 refresh
c20f6e4	3.611606e-02	2.08	DISCARD	HYP-12.8 dynamic periodic loss balancing
272e2b9	3.889626e-02	2.08	DISCARD	HYP-13.4 harder causal curriculum
4f96703	1.595547e-01	2.22	DISCARD	HYP-12.6 spatial tiling path
e38f399	3.763226e-02	2.08	DISCARD	HYP-13.5 local adaptive R3 refresh
365058f	3.745969e-02	2.08	DISCARD	HYP-13.6 adaptive power prior weight
029d1d3	3.462462e-02	2.08	DISCARD	HYP-11.10 breather period calibration
74e2a47	3.347152e-02	2.08	DISCARD	HYP-9.3 BGDA proxy loss balancing
e77ae32	nan	nan	CRASH	HYP-10.2 wavelet PIKAN core
970365b	5.882751e-02	0.98	DISCARD	HYP-10.2 wavelet PIKAN retry
e2d45dc	4.111483e-02	3.05	DISCARD	HYP-11.11 denser collocation set
208dd0c	3.442049e+00	1.68	DISCARD	HYP-10.3 complex phase-coupled core
6a074f0	8.212187e-02	2.30	DISCARD	HYP-10.4 linear attention core
3bacc9f	5.161547e-02	6.02	DISCARD	HYP-12.1 lightweight PIKAN core
127a105	3.797487e-02	2.16	DISCARD	HYP-13.1 operator hybrid core
70d748a	4.908654e-02	2.22	DISCARD	HYP-13.2 stabilized SIREN residual branch
24fa4f0	4.534418e-02	2.05	DISCARD	HYP-13.3 XPINN two-slab core
923bb3e	4.077232e-02	2.08	DISCARD	HYP-14.1 TMA-PINN adaptive recipe
